name,description,longDescription,category,logoColor,websiteURL,githubURL,docsURL
React,"JavaScript library for building user interfaces with component-based architecture","A JavaScript library for building user interfaces, developed and maintained by Facebook. React enables developers to build reusable UI components and manage state efficiently, making it ideal for creating interactive frontends for AI applications. Its component-based architecture and virtual DOM provide performance and maintainability benefits.",applications,#61DAFB,https://reactjs.org,https://github.com/facebook/react,https://react.dev/learn
Kubernetes,"Container orchestration platform for automated deployment, scaling, and management of containerized applications","The de facto standard platform for container orchestration, providing automated deployment, scaling, self-healing, and management of containerized applications. Kubernetes abstracts away infrastructure complexity and forms the foundation for many cloud-native AI platforms.",infrastructure,#326CE5,https://kubernetes.io,https://github.com/kubernetes/kubernetes,https://kubernetes.io/docs/home/
Terraform,"Infrastructure as Code tool for building, changing, and versioning infrastructure safely and efficiently","An open-source infrastructure as code software tool that enables developers to use a declarative configuration language to provision and manage cloud infrastructure, on-premises resources, and third-party services. Terraform allows teams to define infrastructure configurations that can be versioned, reused, and shared.",infrastructure,#7B42BC,https://www.terraform.io,https://github.com/hashicorp/terraform,https://developer.hashicorp.com/terraform/docs
Docker,"Platform for developing, shipping, and running applications in containers","A platform for building, shipping, and running applications in containers. Docker packages applications with their dependencies into standardized units called containers, which can run consistently across different environments, enabling simplified deployment and scaling of applications.",infrastructure,#2496ED,https://www.docker.com,https://github.com/docker,https://docs.docker.com
PyTorch,Open source machine learning framework for deep learning with dynamic computation graph,"A flexible deep learning framework with a dynamic computation graph that enables intuitive model development. PyTorch provides GPU acceleration, distributed training capabilities, and a rich ecosystem of tools and libraries for research and production AI applications.",modeldevelopment,#EE4C2C,https://pytorch.org,https://github.com/pytorch/pytorch,https://pytorch.org/docs/stable/index.html
LangChain,"Framework for developing applications powered by language models with integrated components for RAG, agents, and memory","A framework for building applications with large language models (LLMs) that provides components for retrieval augmented generation (RAG), agents, chains, memory systems, and tools integration. LangChain enables developers to create complex, stateful, and context-aware LLM applications.",llmops,#13C296,https://www.langchain.com,https://github.com/langchain-ai/langchain,https://python.langchain.com/docs/get_started/introduction
Milvus,Open-source vector database for similarity search and AI applications supporting billions of high-dimensional vectors,"A cloud-native vector database designed for storing, indexing, and retrieving embeddings and feature vectors at scale. Milvus offers efficient similarity search capabilities, multiple index types, and integrations with ML frameworks, making it ideal for recommendation systems, image retrieval, and semantic search applications.",featurestore,#4FC08D,https://milvus.io,https://github.com/milvus-io/milvus,https://milvus.io/docs
MLflow,"Platform for ML lifecycle management including experiment tracking, model deployment, and registry","An open-source platform for managing the complete machine learning lifecycle, from experiment tracking and model packaging to deployment and registry. MLflow provides tools for reproducibility, collaboration, and model governance across diverse ML environments and frameworks.",mlops,#0194E2,https://mlflow.org,https://github.com/mlflow/mlflow,https://mlflow.org/docs/latest/index.html
Apache Airflow,"Platform to programmatically author, schedule, and monitor workflows and data pipelines","A workflow orchestration platform that enables programmatic authoring, scheduling, and monitoring of complex data pipelines. Airflow uses Python to define workflows as directed acyclic graphs (DAGs), providing scheduling, retry logic, monitoring, and integrations with many data systems and cloud providers.",mlops,#017BBE,https://airflow.apache.org,https://github.com/apache/airflow,https://airflow.apache.org/docs/
Hugging Face,"Platform for machine learning with transformers, models, datasets, and community collaboration","A comprehensive platform for machine learning that includes the Transformers library, pre-trained models, datasets, and tools for training, fine-tuning, and deploying AI models. Hugging Face provides both open-source libraries and managed services for model hosting, with a strong focus on community-driven development and sharing.",modeldevelopment,#FFBD59,https://huggingface.co,https://github.com/huggingface,https://huggingface.co/docs
Ray,Distributed computing framework for scaling AI and Python applications with parallel processing libraries,"A unified compute framework that makes it simple to scale AI and Python workloads from a laptop to a cluster. Ray provides libraries for distributed training (Ray Train), hyperparameter tuning (Ray Tune), reinforcement learning (Ray RLlib), and model serving (Ray Serve), all built on a common distributed execution engine.",infrastructure,#028CF0,https://www.ray.io,https://github.com/ray-project/ray,https://docs.ray.io/
Prometheus,Monitoring and alerting toolkit for cloud-native applications and infrastructure,"An open-source monitoring and alerting system designed for reliability and scalability in dynamic cloud-native environments. Prometheus collects metrics from configured targets, stores them efficiently, and provides powerful querying capabilities along with alerting based on these metrics.",monitoring,#E6522C,https://prometheus.io,https://github.com/prometheus/prometheus,https://prometheus.io/docs/introduction/overview/
vLLM,High-throughput and memory-efficient inference and serving engine for LLMs with PagedAttention technology,"A high-performance inference and serving engine for large language models (LLMs) that implements PagedAttention, an efficient attention algorithm that manages attention key-value tensors using paging to significantly improve GPU memory usage and increase throughput for LLM inference.",modelserving,#FF6B6B,https://docs.vllm.ai,https://github.com/vllm-project/vllm,https://docs.vllm.ai/en/latest/
Grafana,"Analytics and interactive visualization platform for metrics, logs, and traces with dashboarding","A multi-platform open-source analytics and interactive visualization web application that provides charts, graphs, and alerts when connected to supported data sources. Grafana allows for querying, visualizing, and understanding metrics across systems, applications, and infrastructure.",monitoring,#F05A28,https://grafana.com,https://github.com/grafana/grafana,https://grafana.com/docs/
Streamlit,Framework for turning data scripts into shareable web apps in Python with minimal frontend experience,"A Python library that makes it easy to create and share custom web applications for machine learning and data science projects. Streamlit transforms data scripts into shareable web apps with minimal front-end experience required, allowing data scientists to quickly build interactive data applications.",applications,#FF4B4B,https://streamlit.io,https://github.com/streamlit/streamlit,https://docs.streamlit.io/
Weights & Biases,"Developer tools for machine learning experiment tracking, dataset versioning, and model management","A developer-first MLOps platform that provides experiment tracking, dataset versioning, model management, and evaluation tools. Weights & Biases helps teams build better models faster with tools for tracking experiments, visualizing results, managing datasets, and collaborating with team members.",mlops,#FFBE00,https://wandb.ai,https://github.com/wandb/wandb,https://docs.wandb.ai/
LlamaIndex,Data framework for LLM applications to connect custom data sources to large language models,"A data framework for building LLM applications over custom data sources, providing tools to ingest, structure, and access private or domain-specific data for retrieval-augmented generation (RAG). LlamaIndex handles data ingestion, chunking, embedding, and querying with features for semantic search and context-augmented generation.",llmops,#5D66F5,https://www.llamaindex.ai,https://github.com/jerryjliu/llama_index,https://docs.llamaindex.ai/
Pinecone,Vector database for storing and searching vector embeddings for machine learning applications,"A fully managed, cloud-native vector database optimized for vector search at scale. Pinecone provides high-performance, low-latency similarity search for machine learning applications such as recommendation systems, semantic search, image retrieval, and LLM-based applications with RAG.",featurestore,#4C64EE,https://www.pinecone.io,https://github.com/pinecone-io,https://docs.pinecone.io/
Kubeflow,"Machine learning toolkit for Kubernetes to deploy, monitor, and manage ML systems","A comprehensive platform for deploying, monitoring, and managing machine learning systems on Kubernetes. Kubeflow provides end-to-end orchestration of ML workflows, including notebook environments, training pipelines, hyperparameter tuning, model tracking, and serving, all running on Kubernetes infrastructure.",mlops,#4279F4,https://www.kubeflow.org,https://github.com/kubeflow/kubeflow,https://www.kubeflow.org/docs/
Seldon Core,Production-ready platform for deploying and managing machine learning models on Kubernetes,"An open-source platform for deploying and managing machine learning models in production environments on Kubernetes. Seldon Core provides advanced model serving patterns like A/B testing, canary deployments, and multi-armed bandits, along with monitoring, explainability, and scalability features.",modelserving,#19486F,https://www.seldon.io/,https://github.com/SeldonIO/seldon-core,https://docs.seldon.io/projects/seldon-core/en/latest/
TensorFlow,End-to-end open source platform for machine learning with comprehensive ecosystem,"A comprehensive machine learning platform with a flexible ecosystem of tools, libraries, and community resources. TensorFlow provides end-to-end capabilities from model development to production deployment with integrated components for data processing, model training, evaluation, and serving.",modeldevelopment,#FF6F00,https://www.tensorflow.org/,https://github.com/tensorflow/tensorflow,https://www.tensorflow.org/guide
AutoGen,Framework for building multi-agent systems with LLMs that can work together to solve complex tasks,"A framework for building applications using multiple agents that can converse with each other, solve tasks, and call functions to use tools. AutoGen agents can adapt to using different LLMs, have customizable persona and instructions, and have been used to build complex systems like co-development teams, research assistants, and more.",llmops,#7F56D9,https://microsoft.github.io/autogen/,https://github.com/microsoft/autogen,https://microsoft.github.io/autogen/docs/getting-started
LangGraph,"Framework for building stateful, multi-actor applications using language models","A framework for creating stateful, multi-actor applications with language models, enabling complex, interactive LLM applications. LangGraph uses a graph-based paradigm to represent the flow of information between different components or agents, making it easier to build conversational agents, multi-step reasoning systems, and tools that require persistent state.",llmops,#18CC42,https://www.langchain.com/langgraph,https://github.com/langchain-ai/langgraph,https://python.langchain.com/docs/langgraph
Evidently,"Open-source tools to evaluate, test, and monitor ML models in production","An open-source toolkit for ML model evaluation, testing, and monitoring that helps detect data drift, model drift, and performance issues. Evidently provides visual reports and Python tools for data quality validation, drift detection, and model performance analysis throughout the ML lifecycle.",monitoring,#EF463A,https://www.evidentlyai.com/,https://github.com/evidentlyai/evidently,https://docs.evidentlyai.com/
Snowflake,Cloud data platform with support for machine learning and data sharing,"A cloud-based data platform that provides a data warehouse-as-a-service designed for the cloud. Snowflake enables data storage, processing, and analytic solutions with seamless data sharing, machine learning integration, and multi-cloud support.",datalayer,#29B5E8,https://www.snowflake.com,https://github.com/snowflakedb,https://docs.snowflake.com
Databricks,Unified data analytics platform for processing big data and building machine learning models,"A unified data and AI platform that combines data engineering, data science, machine learning, and analytics on a single platform built around Apache Spark. Databricks provides collaborative notebooks, optimized Spark clusters, ML model management, and an open lakehouse architecture.",datalayer,#FF3621,https://www.databricks.com,https://github.com/databricks,https://docs.databricks.com
Feast,Open source feature store for machine learning with consistent feature access,"An open-source feature store for machine learning that enables teams to consistently define, store, serve, and share features across projects. Feast provides a centralized repository for machine learning features, ensuring that the same feature definitions are used for both model training and serving.",featurestore,#02CBB1,https://feast.dev,https://github.com/feast-dev/feast,https://docs.feast.dev
Tecton,Enterprise-grade feature platform for building and serving ML features at scale,"An enterprise-grade feature platform that manages the complete lifecycle of ML features. Tecton provides a central repository for feature definitions, with tools for transformation, orchestration, serving, and monitoring features in both offline and online environments, ensuring consistency between training and production.",featurestore,#3D4BF2,https://www.tecton.ai,https://github.com/tecton-ai,https://docs.tecton.ai
Databricks Feature Store,Managed feature store integrated with Databricks that unifies feature management,"A centralized repository for machine learning features built into the Databricks platform. The Databricks Feature Store enables teams to discover and reuse existing features, automatically handle point-in-time correctness, and ensure consistent feature transformations between training and serving, all integrated with the rest of the Databricks ecosystem.",featurestore,#FF3621,https://www.databricks.com/product/feature-store,,https://docs.databricks.com/machine-learning/feature-store/index.html
Amazon SageMaker Feature Store,Fully managed repository for machine learning features integrated with SageMaker,"A fully managed, purpose-built repository within Amazon SageMaker that makes it easy to store, update, retrieve, and share machine learning features. SageMaker Feature Store provides an online store for low-latency real-time inference and an offline store for training and batch inference, with consistent feature access across both environments.",featurestore,#FF9900,https://aws.amazon.com/sagemaker/feature-store,,https://docs.aws.amazon.com/sagemaker/latest/dg/feature-store.html
Vertex AI Feature Store,Google Cloud's managed feature repository for machine learning pipelines,"A managed feature repository in Google Cloud's Vertex AI platform that enables efficient management, sharing, and serving of machine learning features. It helps ensure consistent feature values between training and serving, with integrated time-travel capabilities for point-in-time accurate training and both online and batch serving capabilities.",featurestore,#4285F4,https://cloud.google.com/vertex-ai/docs/featurestore,,https://cloud.google.com/vertex-ai/docs/featurestore/overview
Hopsworks Feature Store,Open-source Python-centric feature store with unified storage for features and metadata,"An open-source feature store that simplifies the management and serving of features for machine learning. Hopsworks provides both online and offline storage, Python-based feature engineering, time-travel capabilities, and monitoring for feature data, along with a feature registry for documenting and discovering features across teams.",featurestore,#FF3A4E,https://www.hopsworks.ai,https://github.com/logicalclocks/hopsworks,https://docs.hopsworks.ai
Redis Enterprise for Feature Store,High-performance real-time feature serving built on Redis for ML applications,"A feature storage and serving solution built on Redis that enables real-time feature serving for machine learning applications. Redis Enterprise for Feature Store provides sub-millisecond feature retrieval, support for vector embeddings, and scalable deployment options, making it ideal for low-latency online inference scenarios.",featurestore,#DC382D,https://redis.com/solutions/use-cases/feature-store-for-machine-learning,,https://redis.io/docs/stack/search/reference/vectors
Temporal,Open-source microservice orchestration platform for building durable workflows with reliability guarantees,"A microservice orchestration platform that simplifies building applications with complex, reliability-critical business logic. Temporal provides durable execution, automated retries, and long-running workflow support, making it ideal for ML workflows, data pipelines, and stateful service orchestration in AI systems.",infrastructure,#276EF1,https://temporal.io,https://github.com/temporalio/temporal,https://docs.temporal.io
Apache Airflow,"Platform for programmatically authoring, scheduling, and monitoring data and ML workflows","An open-source workflow management platform that enables teams to programmatically author, schedule, and monitor workflows as directed acyclic graphs (DAGs). Airflow is widely used for data engineering and ML pipelines, providing rich scheduling, dependency management, and monitoring capabilities.",mlops,#017CEE,https://airflow.apache.org,https://github.com/apache/airflow,https://airflow.apache.org/docs
Dagster,Data orchestration platform focused on developer productivity and observability for ML pipelines,"An open-source orchestration platform for the development, production, and observation of data assets. Dagster combines data orchestration capabilities with asset management features, enabling teams to define, test, and deploy data and ML pipelines with improved developer productivity and robust observability.",datalayer,#412A79,https://dagster.io,https://github.com/dagster-io/dagster,https://docs.dagster.io
Flyte,Kubernetes-native workflow automation platform designed for ML and data processing,"A Kubernetes-native workflow automation platform designed for highly concurrent, scalable, and maintainable workflows. Flyte is particularly suited for machine learning and data processing, offering strong typing, containerization, caching, and versioning capabilities to ensure reproducibility and reliability in production.",mlops,#51ABFF,https://flyte.org,https://github.com/flyteorg/flyte,https://docs.flyte.org
Metaflow,Human-friendly Python framework for building and managing data science workflows,"A human-centric framework for data science that helps teams build and manage real-life data science projects. Created at Netflix, Metaflow focuses on making ML workflows easy to develop, deploy, and operate, with features for versioning, dependency management, and seamless deployment to production infrastructure.",mlops,#12887A,https://metaflow.org,https://github.com/Netflix/metaflow,https://docs.metaflow.org
Luigi,Python package for building complex pipelines of batch jobs with dependency resolution,"A Python package that helps build complex pipelines of batch jobs with dependency resolution. Built at Spotify, Luigi handles dependency resolution, workflow management, visualization, and failure recovery for data pipelines, making it useful for ETL processes and machine learning workflows.",datalayer,#41AF46,https://luigi.readthedocs.io,https://github.com/spotify/luigi,https://luigi.readthedocs.io/en/stable/
LiteLLM Proxy,"Production-ready LLM gateway with load balancing, fallbacks, and observability","A production-ready LLM gateway that provides a proxy server for different LLM APIs with a unified interface. LiteLLM Proxy offers load balancing across providers, fallbacks for reliability, caching for performance, and extensive monitoring and logging capabilities to manage LLM costs and performance in production.",modelserving,#6366F1,https://litellm.ai/proxy,https://github.com/BerriAI/litellm,https://docs.litellm.ai/docs/proxy/self_hosting
Llama Gateway,Managed REST API gateway with observability for LlamaIndex and other LLM frameworks,"A managed REST API service that provides gateway functionality for LlamaIndex applications. Llama Gateway offers observability, monitoring, and scaling capabilities for LLM applications built with LlamaIndex, enabling teams to easily deploy and manage RAG and other LLM-based applications in production.",modelserving,#5D66F5,https://cloud.llamaindex.ai,https://github.com/run-llama/llama_index,https://docs.llamaindex.ai/en/stable/module_guides/deploying/llama_cloud/llama_cloud.html
Haystack LLM Gateway,Framework for building production-ready LLM applications with flexible inference options,"A framework that provides a unified interface for building LLM applications with multiple deployment options. Haystack LLM Gateway enables flexible switching between different LLM providers, optimizing for cost, performance, or capabilities, while providing robust error handling and monitoring for production environments.",modelserving,#4DA9F8,https://haystack.deepset.ai,https://github.com/deepset-ai/haystack,https://docs.haystack.deepset.ai/docs/llm-inference
GPT Cache,Semantic caching for LLMs to reduce duplicate requests and improve response times,"A library for semantic caching of LLM calls that helps reduce the number of duplicate requests to LLM services. GPT Cache uses similarity-based caching to identify semantically similar queries and return cached responses, reducing latency and API costs while maintaining response quality.",modelserving,#4F4F4F,https://gptcache.readthedocs.io,https://github.com/zilliztech/gptcache,https://gptcache.readthedocs.io/en/latest/
NVIDIA AI Enterprise,End-to-end platform for developing and deploying AI applications with enterprise support,"An end-to-end, cloud-native suite of AI and data analytics software optimized for NVIDIA accelerated computing. NVIDIA AI Enterprise provides enterprise-grade support, security, and performance for the full AI development and deployment lifecycle, from data processing and model training to inference and monitoring.",infrastructure,#76B900,https://www.nvidia.com/en-us/data-center/products/ai-enterprise,,https://docs.nvidia.com/ai-enterprise
OpenLLM,Open platform for operating LLMs in production with observability and scalability,"An open-source platform for operating large language models in production, built on BentoML. OpenLLM simplifies fine-tuning, serving, and deployment of LLMs with features for model management, observability, and automatic optimization of inference for different hardware configurations.",modelserving,#635BFF,https://openllm.ai,https://github.com/bentoml/OpenLLM,https://openllm.ai/docs
SkyPilot,"Framework for running LLMs, AI, and batch jobs on any cloud with cost optimization","An open-source framework that simplifies running machine learning workloads on the cloud, automatically finding the best cloud with available resources at the lowest price. SkyPilot offers managed cloud spot instances, job queueing, and a unified interface for multi-cloud environments, making it ideal for running resource-intensive LLM training and fine-tuning.",infrastructure,#2374CD,https://skypilot.readthedocs.io,https://github.com/skypilot-org/skypilot,https://skypilot.readthedocs.io/en/latest/
LangSmith,"Platform for debugging, testing, evaluating, and monitoring LLM applications","A platform designed to help developers understand, debug, and improve their LLM applications throughout the development lifecycle. LangSmith provides telemetry, tracing, testing, and evaluation tools for LLM-based applications, enhancing observability and enabling systematic improvement of model quality and reliability.",monitoring,#00C4B8,https://smith.langchain.com,https://github.com/langchain-ai/langsmith-sdk,https://docs.smith.langchain.com
Prompt Flow,"Platform for building, evaluating, and deploying LLM-powered applications","A development tool for building, evaluating, and deploying LLM applications, part of Microsoft's AI platform. Prompt Flow provides visual workflow design for LLM applications, evaluation frameworks for prompts and models, and integration with Azure's AI services, simplifying the development of complex LLM applications.",mlops,#0078D4,https://microsoft.github.io/promptflow,https://github.com/microsoft/promptflow,https://microsoft.github.io/promptflow/how-to-guides/index.html
