name,description,longDescription,category,logoColor,websiteURL,githubURL,docsURL
Prodigy,Annotation tool for creating training data for machine learning models,"An efficient annotation tool designed for creating training data for machine learning models. Prodigy provides an intuitive annotation interface, active learning for more efficient data labeling, and customizable workflows for text, image, audio, and video data, helping teams build high-quality datasets faster.",datalayer,#09A3D5,https://prodi.gy,,https://prodi.gy/docs
V7,End-to-end training data platform for computer vision and multimodal models,"An end-to-end training data platform for computer vision and multimodal models. V7 offers tools for data labeling, dataset management, model training, and automated workflows, with features for auto-annotation, quality control, and collaboration designed for building high-quality training datasets.",datalayer,#5145CD,https://www.v7labs.com,,https://docs.v7labs.com
CVAT,Open-source interactive image and video annotation tool for computer vision,"An open-source tool for labeling images and videos for computer vision datasets. CVAT provides powerful annotation capabilities for segmentation, classification, and tracking tasks, with support for multiple annotation formats and integration with various ML frameworks for semi-automated labeling.",datalayer,#1E88E5,https://www.cvat.ai,https://github.com/opencv/cvat,https://opencv.github.io/cvat/docs
Label Studio,"Open-source data labeling tool for various data types including text, images, audio, and video","An open-source data labeling tool that handles various data types including text, images, audio, and video. Label Studio offers a flexible interface for creating labeled datasets, with customizable labeling templates, collaboration features, and integrations with ML frameworks for active learning and model-assisted labeling.",datalayer,#4A5768,https://labelstud.io,https://github.com/heartexlabs/label-studio,https://labelstud.io/guide
Aquarium Learning,Dataset curation platform for improving computer vision models through systematic error analysis,"A dataset curation platform for improving computer vision models through systematic error analysis and targeted data collection. Aquarium helps identify model failure modes, curate more effective training datasets, and close the loop between model performance and data quality to iteratively improve model accuracy.",monitoring,#0DCCBB,https://www.aquariumlearning.com,,https://docs.aquariumlearning.com
Encord,"Data-centric computer vision platform for labeling, QA, and dataset curation","A data-centric computer vision platform for creating high-quality training data. Encord provides tools for data labeling, quality assurance, and dataset curation, with features for automated workflows, model-assisted labeling, and performance analysis to enhance model accuracy through better data.",datalayer,#FF4E64,https://encord.com,https://github.com/encord-team,https://docs.encord.com
Roboflow,"Computer vision platform for dataset management, annotation, and model training","An end-to-end computer vision platform that helps developers create and deploy custom vision AI models. Roboflow provides tools for dataset management, image annotation, model training, and deployment, with pre-built solutions for object detection, classification, and segmentation tasks.",modeldevelopment,#4D35BA,https://roboflow.com,https://github.com/roboflow,https://docs.roboflow.com
Argilla,Open-source data curation platform for LLMs and other ML tasks,"An open-source data curation platform designed to efficiently collect and manage feedback for LLMs and other ML tasks. Argilla enables teams to collaboratively annotate, evaluate, and curate data for training and fine-tuning models, with built-in support for popular LLM use cases and human-in-the-loop workflows.",datalayer,#FF3A4E,https://argilla.io,https://github.com/argilla-io/argilla,https://docs.argilla.io
DVC Data,Component of DVC designed for versioning datasets and ML models,"A component of Data Version Control (DVC) that specializes in versioning datasets and ML models. DVC Data provides a Git-like interface for tracking large files, enabling reproducible ML projects by versioning data alongside code, with support for remote storage and dataset lineage tracking.",datalayer,#13ADC7,https://dvc.org/doc/start/data-management,https://github.com/iterative/dvc,https://dvc.org/doc/user-guide/data-management
Doccano,Open-source text annotation tool for machine learning practitioners,"An open-source text annotation tool for creating labeled datasets for NLP tasks. Doccano supports various types of text annotation including classification, sequence labeling, and sequence-to-sequence tasks, with a collaborative interface for teams to efficiently create high-quality training data.",datalayer,#03A9F4,https://doccano.github.io/doccano,https://github.com/doccano/doccano,https://doccano.github.io/doccano/getting-started
Dataturks,"Data annotation platform for text, images, and videos with collaboration features","A data annotation platform for text, images, and videos that enables teams to create labeled datasets for machine learning. Dataturks provides an intuitive interface for various annotation tasks, with features for team collaboration, quality control, and project management to streamline the data labeling process.",datalayer,#FF7043,https://dataturks.com,https://github.com/DataTurks/DataTurks,https://dataturks.com/help
Appen,AI training data platform with human-in-the-loop annotation for various data types,"A comprehensive training data platform that combines human-in-the-loop annotation with machine learning assistance to create high-quality datasets. Appen provides solutions for data collection, annotation, and validation across text, image, audio, and video data types, with a global crowd workforce for scaling data labeling projects.",datalayer,#FE4F25,https://appen.com,,https://success.appen.com
Toloka,Crowdsourcing platform for data labeling and human evaluation of AI systems,"A crowdsourcing platform that helps collect and label data at scale through distributed work. Toloka enables organizations to create training datasets and evaluate AI systems with human input, providing tools for task design, quality control, and workforce management for efficient and accurate data labeling.",datalayer,#FFCC00,https://toloka.ai,,https://toloka.ai/docs
Datasaur,Text annotation platform with pre-labeling capabilities for efficient dataset creation,"A text annotation platform designed specifically for natural language processing datasets. Datasaur offers pre-labeling capabilities using existing models, project management features, and quality control workflows to streamline the creation of labeled text datasets for training, fine-tuning, and evaluating NLP models.",datalayer,#00DE7A,https://datasaur.ai,,https://docs.datasaur.ai
SuperAnnotate,"End-to-end platform for image, video, and text annotation with automated workflows","An end-to-end platform for annotating images, videos, and text with automated annotation capabilities. SuperAnnotate provides tools for project management, quality assurance, and automated workflows for creating high-quality training data, with features for team collaboration and integration with model training pipelines.",datalayer,#2EA4F7,https://www.superannotate.com,,https://docs.superannotate.com
Kili Technology,Collaborative platform for annotating and training data with focus on complex images and documents,"A collaborative platform for annotating and training data with a focus on complex images and documents. Kili Technology combines annotation capabilities with automated labeling features, quality control workflows, and advanced project management to efficiently create high-quality labeled datasets for AI training.",datalayer,#0D4DF1,https://kili-technology.com,,https://cloud.kili-technology.com/documentation
DataHeroes,"Platform for data preparation, enrichment, labeling, and governance for AI development","A platform for data preparation, enrichment, labeling, and governance for AI development. DataHeroes provides end-to-end capabilities for managing training data, with tools for data cleaning, transformation, annotation, and quality assurance to ensure high-quality datasets for developing and improving AI models.",security,#3C3CE5,https://dataheroes.ai,,https://docs.dataheroes.ai
Diffgram,Open-source training data platform for computer vision with built-in version control,"An open-source training data platform for computer vision with built-in version control. Diffgram provides tools for annotation, dataset management, and ML-assisted labeling, with unique features for tracking changes to annotations over time and integrating with model training workflows.",datalayer,#4A6FF3,https://diffgram.com,https://github.com/diffgram/diffgram,https://diffgram.readme.io
DSPy,Framework for programming with language models through modules and optimizers,"A framework for algorithmically programming language models by separating prompting logic from model calls. DSPy offers programmatic optimization of language model programs, enabling systematic improvement of LLM applications through techniques like fine-tuning prompts based on past results and tracing complex reasoning steps.",llmops,#3872D9,https://dspy.ai,https://github.com/stanfordnlp/dspy,https://dspy-docs.vercel.app
vLLM Server,High-throughput service for LLM inference with API compatibility and optimized performance,"A high-performance service built on vLLM for serving large language models with OpenAI-compatible API endpoints. vLLM Server delivers optimized inference through techniques like PagedAttention and tensor parallelism, supporting various deployment options with both popular open-source and proprietary models.",modelserving,#FF6B6B,https://docs.vllm.ai,https://github.com/vllm-project/vllm,https://docs.vllm.ai/en/latest/serving/openai_compatible_server.html
DVC (Data Version Control),Open-source version control system for machine learning projects,"An open-source version control system for machine learning projects that works with Git to version data and models, making ML projects reproducible and shareable. DVC tracks changes to data, models, and intermediate files while keeping a lightweight Git repository.",mlops,#13ADC7,https://dvc.org,https://github.com/iterative/dvc,https://dvc.org/doc
FastAPI,High-performance web framework for building APIs with Python based on standard type hints,"A modern, fast web framework for building APIs with Python based on standard Python type hints, providing automatic API documentation, data validation, and high performance. FastAPI is particularly well-suited for building machine learning APIs and microservices.",applications,#009688,https://fastapi.tiangolo.com,https://github.com/tiangolo/fastapi,https://fastapi.tiangolo.com/tutorial/
BentoML,Unified model serving framework for scalable machine learning model serving,"An open-source framework for high-performance machine learning model serving, enabling teams to standardize model deployment, create prediction services, and seamlessly transition models from research to production with optimized performance and monitoring.",modelserving,#635BFF,https://www.bentoml.com,https://github.com/bentoml/BentoML,https://docs.bentoml.org
Langsmith,"Platform for debugging, testing, evaluating, and monitoring LLM applications","A platform designed specifically for LLM application development that offers comprehensive tooling for debugging, testing, evaluating, and monitoring language model applications. LangSmith helps teams understand, evaluate, and improve their language model applications throughout the development lifecycle.",monitoring,#00C4B8,https://www.langsmith.com,https://github.com/langchain-ai/langsmith-sdk,https://docs.smith.langchain.com
OpenAI API,APIs for accessing powerful large language models and AI capabilities,"A set of APIs providing access to state-of-the-art large language models and AI capabilities, enabling developers to integrate advanced language understanding, generation, and reasoning abilities into applications. OpenAI APIs power a wide range of AI applications from conversational agents to content generation.",modelserving,#412991,https://openai.com/api,https://github.com/openai/openai-python,https://platform.openai.com/docs/introduction
Helm,Package manager for Kubernetes that simplifies deploying and managing applications,"A package manager for Kubernetes that simplifies the deployment and management of applications in Kubernetes clusters. Helm provides templates called charts that define, install, and upgrade complex Kubernetes applications, making it easier to standardize deployments.",infrastructure,#0F1689,https://helm.sh,https://github.com/helm/helm,https://helm.sh/docs/
Argo Workflows,Container-native workflow engine for orchestrating parallel jobs on Kubernetes,"An open-source container-native workflow engine for orchestrating parallel jobs on Kubernetes. Argo Workflows is designed to orchestrate complex, multi-step workflows for machine learning, data processing, and CI/CD, providing visualization, templating, and scheduling capabilities.",mlops,#1A56DB,https://argoproj.github.io/workflows,https://github.com/argoproj/argo-workflows,https://argoproj.github.io/argo-workflows/docs/
NVIDIA Triton Inference Server,Open-source inference serving software for deploying AI models at scale,"An open-source inference serving software that standardizes model deployment and execution across diverse hardware platforms. Triton Inference Server supports models from different frameworks (TensorFlow, PyTorch, ONNX, TensorRT) and optimizes performance for both real-time and batch inference scenarios.",modelserving,#76B900,https://developer.nvidia.com/triton-inference-server,https://github.com/triton-inference-server/server,https://docs.nvidia.com/deeplearning/triton-inference-server/user-guide/docs/index.html
Gradio,Python library for quickly creating customizable UI components for machine learning models,"A Python library that allows developers to quickly create customizable web interfaces for machine learning models. Gradio makes it easy to demo models, get user feedback, and share interactive applications with just a few lines of code, supporting text, image, audio, and video inputs/outputs.",applications,#F97516,https://www.gradio.app,https://github.com/gradio-app/gradio,https://www.gradio.app/docs
Airflow,"Platform to programmatically author, schedule, and monitor workflows and data pipelines","A workflow orchestration platform that enables programmatic authoring, scheduling, and monitoring of complex data pipelines. Airflow uses Python to define workflows as directed acyclic graphs (DAGs), providing scheduling, retry logic, monitoring, and integrations with many data systems and cloud providers.",datalayer,#017CEE,https://airflow.apache.org,https://github.com/apache/airflow,https://airflow.apache.org/docs/
Chroma,Open-source embedding database for AI applications with simple API,"An open-source embedding database designed for AI applications that makes it easy to store, manage, and query vector embeddings. Chroma provides a simple API for building AI applications with semantic search capabilities, particularly for retrieval-augmented generation systems.",featurestore,#6166DC,https://www.trychroma.com,https://github.com/chroma-core/chroma,https://docs.trychroma.com
dbt (data build tool),Command-line tool for analytics engineering that enables data transformation in warehouses,"A development framework that enables analytics engineers to transform data in their warehouses by writing modular SQL while leveraging engineering best practices like version control and CI/CD. dbt helps teams create reliable data pipelines with testing, documentation, and lineage tracking.",datalayer,#FF694B,https://www.getdbt.com,https://github.com/dbt-labs/dbt-core,https://docs.getdbt.com
Deepgram,Speech-to-text API platform with real-time transcription and understanding capabilities,"An AI speech recognition platform that provides real-time transcription with high accuracy and advanced features like speaker diarization, language detection, and topic detection. Deepgram uses deep learning to deliver speech-to-text capabilities optimized for specific domains and use cases.",applications,#52ADFF,https://deepgram.com,https://github.com/deepgram,https://developers.deepgram.com/docs
NVIDIA GPU Cloud (NGC),"Container registry and catalog for GPU-optimized software for AI, machine learning, and HPC","A hub for GPU-optimized software that provides ready-to-run containers for AI, machine learning, and high-performance computing. NGC offers AI frameworks, industry solutions, and SDKs optimized for NVIDIA GPUs, enabling developers to start quickly with pre-configured environments.",infrastructure,#76B900,https://catalog.ngc.nvidia.com,https://github.com/NVIDIA,https://docs.nvidia.com/ngc/
MinIO,"High-performance, S3-compatible object storage for AI and ML workloads","A high-performance, S3-compatible object storage system built for AI/ML workloads, providing the performance, scalability, and data protection required for large-scale machine learning operations. MinIO is optimized for large datasets and offers features like erasure coding, bitrot protection, and encryption.",datalayer,#C72C48,https://min.io,https://github.com/minio/minio,https://docs.min.io
Apache Spark,Unified analytics engine for large-scale data processing with support for ML workloads,"A unified analytics engine for large-scale data processing that provides high-level APIs in Java, Scala, Python, and R, and includes libraries for SQL, streaming, machine learning (MLlib), and graph processing. Spark offers speed, ease of use, and sophisticated analytics for big data workloads.",datalayer,#E25A1C,https://spark.apache.org,https://github.com/apache/spark,https://spark.apache.org/docs/latest/
Weaviate,Open-source vector database with semantic search and generative capabilities,"An open-source vector database that enables developers to build applications with semantic search, generative AI, and language understanding capabilities. Weaviate stores both objects and vectors, allowing for contextual searches, embedding storage, and real-time AI integrations.",featurestore,#FF3256,https://weaviate.io,https://github.com/weaviate/weaviate,https://weaviate.io/developers/weaviate
Qdrant,Vector search engine designed for production-ready similarity search,"An open-source vector similarity search engine with extended filtering support, designed for production environments. Qdrant provides fast and accurate nearest neighbor search with additional payload-based pre-filtering, incremental updates, and horizontal scaling capabilities.",featurestore,#3D6FDB,https://qdrant.tech,https://github.com/qdrant/qdrant,https://qdrant.tech/documentation/
JAX,High-performance numerical computing library with automatic differentiation for ML research,A high-performance numerical computing library that combines NumPy and automatic differentiation for research in machine learning. JAX enables researchers to transform numerical functions with just-in-time compilation to GPU/TPU and automatic differentiation for gradient-based optimization.,modeldevelopment,#0166A9,https://jax.readthedocs.io,https://github.com/google/jax,https://jax.readthedocs.io/en/latest/
Jupyter,"Interactive computing environment for data exploration, visualization, and collaboration","An open-source project providing interactive computing environments across dozens of programming languages. Jupyter Notebooks combine live code, equations, narrative text, and visualizations, making them ideal for data exploration, analysis, sharing insights, and collaborative ML development.",modeldevelopment,#F37726,https://jupyter.org,https://github.com/jupyter/jupyter,https://docs.jupyter.org
ClearML,"MLOps platform for tracking, orchestrating, and automating machine learning workflows","An open-source MLOps platform designed to help teams manage, track and automate their machine learning workflows. ClearML provides experiment tracking, model management, dataset versioning, and orchestration capabilities, enabling seamless tracking from research to production.",mlops,#10AFED,https://clear.ml,https://github.com/allegroai/clearml,https://clear.ml/docs
ZenML,Extensible MLOps framework for creating production-ready ML pipelines,"An extensible MLOps framework that simplifies the creation of production-ready machine learning pipelines. ZenML provides a unified way to define, run, and manage reproducible ML workflows that integrate with various tools and platforms across the ML lifecycle.",mlops,#0F62FE,https://zenml.io,https://github.com/zenml-io/zenml,https://docs.zenml.io
Vertex AI,Google Cloud's unified ML platform for building and deploying models at scale,"Google Cloud's unified machine learning platform enabling data scientists and ML engineers to build, deploy, and scale ML models faster. Vertex AI combines data engineering, ML engineering, and application development into a unified platform with integrated tools for the entire ML lifecycle.",mlops,#4285F4,https://cloud.google.com/vertex-ai,https://github.com/googleapis/python-aiplatform,https://cloud.google.com/vertex-ai/docs
TorchServe,Flexible tool for serving PyTorch models in production environments,"A flexible and easy-to-use tool for serving PyTorch models in production. TorchServe provides a model server optimized for PyTorch models with model versioning, metrics, and monitoring capabilities, making it simple to deploy models via REST API endpoints.",modelserving,#EE4C2C,https://pytorch.org/serve,https://github.com/pytorch/serve,https://pytorch.org/serve/index.html
KServe,Kubernetes-native model serving platform for serverless machine learning inference,"A Kubernetes-native platform for deploying machine learning models as serverless inference services. KServe provides a serverless framework for ML serving with features like autoscaling, canary rollouts, and model explainability, supporting multiple frameworks like TensorFlow, PyTorch, and ONNX.",modelserving,#4279F4,https://kserve.github.io/website,https://github.com/kserve/kserve,https://kserve.github.io/website/latest/get_started/
WhyLabs,AI observability platform for monitoring and improving ML model performance,"An AI observability platform that enables data scientists and engineers to monitor and improve ML model performance in production. WhyLabs detects data drift, model drift, and data quality issues, providing real-time monitoring, alerting, and diagnostic capabilities for ML systems.",monitoring,#7839EE,https://whylabs.ai,https://github.com/whylabs/whylogs,https://docs.whylabs.ai
Great Expectations,"Data quality validation, documentation, and profiling framework","An open-source Python framework for validating, documenting, and profiling data to maintain quality and prevent pipeline failures. Great Expectations helps teams maintain data quality by defining what to expect from their data, validating those expectations, and preventing unexpected issues from affecting downstream systems.",datalayer,#FF5975,https://greatexpectations.io,https://github.com/great-expectations/great_expectations,https://docs.greatexpectations.io
Arize AI,"ML observability platform for monitoring, troubleshooting, and explainability","A machine learning observability platform for monitoring model performance, troubleshooting issues, and explaining model behavior. Arize helps teams detect drift, bias, and data quality issues, track model performance metrics, and debug model predictions with visualization and explainability tools.",monitoring,#0ABCFF,https://arize.com,https://github.com/Arize-ai,https://docs.arize.com
HashiCorp Vault,Secrets management and data protection for sensitive information in AI systems,"A secrets management and data protection platform that controls access to sensitive information in dynamic cloud environments. Vault provides secure storage for API keys, passwords, certificates, and encryption keys, with features for secure access control and audit logging.",security,#000000,https://www.vaultproject.io,https://github.com/hashicorp/vault,https://developer.hashicorp.com/vault/docs
Guild AI,"Experiment tracking, optimization, and reproducibility for machine learning","An open-source tool designed for experiment tracking, reproducibility, and optimization of machine learning models. Guild AI captures experiment results, hyperparameters, dependencies, and artifacts, making it easy to compare runs, optimize hyperparameters, and reproduce results.",mlops,#4DB5AF,https://guild.ai,https://github.com/guildai/guildai,https://my.guild.ai/docs
LlamaHub,Library of data connectors for RAG applications and LLM-based systems,"A collection of data connectors for building LLM-based applications with external data sources. LlamaHub provides ready-to-use connectors for various data sources, simplifying the process of ingesting, transforming, and using custom data with large language models for retrieval-augmented generation.",featurestore,#5E64F9,https://llamahub.ai,https://github.com/run-llama/llama-hub,https://docs.llamaindex.ai/en/stable/module_guides/loading/llama_hub.html
Prefect,"Workflow orchestration tool for building, running, and monitoring data pipelines","A workflow orchestration platform that enables data engineers and data scientists to build, run, and monitor data pipelines. Prefect provides a Pythonic interface for workflow management, with features for scheduling, error handling, retries, and observability for complex data workflows.",datalayer,#24CBE5,https://www.prefect.io,https://github.com/PrefectHQ/prefect,https://docs.prefect.io
